[
    {
        "title": "O podcast primeiro",
        "description": "Long podcast description",
        "image": "https://myimage.gal/pic.png",
        "tags": ["lingua"],
        "feed_url": "https://feed.gal/feed.xml",
        "links": [
            {
                "link": "twitter",
                "url": "sdsafda"
            }
        ],
        "platforms": [
            {
                "platform": "apple",
                "url": "https://feed.gal/feed.xml"
            },
            {
                "platform": "apple",
                "url": "https://feed.gal/feed.xml"
            }
        ],
        "status": "active"
    },
    {
        "title": "O podcast segundo",
        "description": "Long podcast description",
        "image": "https://myimage.gal/pic.png",
        "tags": ["lingua"],
        "feed_url": "https://feed.gal/feed.xml",
        "links": [
            {
                "link": "twitter",
                "url": "sdsafda"
            }
        ],
        "platforms": [
            {
                "platform": "apple",
                "url": "https://feed.gal/feed.xml"
            },
            {
                "platform": "apple",
                "url": "https://feed.gal/feed.xml"
            }
        ],
        "status": "active"
    }
]
